{
  "schemaVersion": 1,
  "evaluationMode": "with-access",
  "problemId": "bssc-sum-capacity",
  "subjectTransactionId": "c70e1829a7c6a2a8cb8cfc2383f8abf825ac5ea6",
  "acceptedClaimRefs": [
    {
      "transactionId": "c70e1829a7c6a2a8cb8cfc2383f8abf825ac5ea6",
      "claimKey": "bssc-sum-capacity/code-induced-dependence-balance-and-entropy-no-go",
      "judgmentId": "sha256:6811dbc06c253fd81a1d9244887b661fff26b22c3cdcda708cd6bdf5642a7293",
      "assessmentDigest": "sha256:68f305d26ca20ec5b3ecdd9e0d216aac0811634a2ce4fa759cab860d912260d7"
    }
  ],
  "knowledgeStateDigest": "sha256:64471ccdbed45510517f681d18b1a96102116fcd246b477b0e1a742b2e2c4be5",
  "safeFactsDigest": "sha256:92e4be0e93f852c78db60b29885269473456c0a199f9fed87e63f4c745f6e12e",
  "safeFactsEvidenceManifestDigest": "sha256:4851a0687f975a125a86eb07e04c2365aa09a4f502571b0813cf8148fd3da7ee",
  "impactContext": {
    "schemaVersion": 1,
    "problemId": "bssc-sum-capacity",
    "subjectTransactionId": "c70e1829a7c6a2a8cb8cfc2383f8abf825ac5ea6",
    "acceptedClaimRefs": [
      {
        "transactionId": "c70e1829a7c6a2a8cb8cfc2383f8abf825ac5ea6",
        "claimKey": "bssc-sum-capacity/code-induced-dependence-balance-and-entropy-no-go",
        "judgmentId": "sha256:6811dbc06c253fd81a1d9244887b661fff26b22c3cdcda708cd6bdf5642a7293",
        "assessmentDigest": "sha256:68f305d26ca20ec5b3ecdd9e0d216aac0811634a2ce4fa759cab860d912260d7"
      }
    ],
    "knowledgeStateDigest": "sha256:64471ccdbed45510517f681d18b1a96102116fcd246b477b0e1a742b2e2c4be5",
    "seedNodeRefs": [
      {
        "kind": "thread",
        "id": "root/unstructured-search"
      }
    ],
    "descendantDepth": 1,
    "includedNodes": [
      {
        "ref": {
          "kind": "program",
          "id": "root"
        },
        "parentRef": null,
        "status": "active",
        "roles": [
          "seed",
          "seed-owner"
        ],
        "recordDigest": "sha256:6c667e70ec5eeb0bbca5cc382893b021b8e4dff33403e3ec09d92532f24e49dd"
      },
      {
        "ref": {
          "kind": "program",
          "id": "root/code-structure-converse"
        },
        "parentRef": {
          "kind": "program",
          "id": "root"
        },
        "status": "active",
        "roles": [
          "descendant"
        ],
        "recordDigest": "sha256:b9dcb917359a21c184538fcd5afde2659b0ec70a3c8b37cda415f835ceb7af26"
      },
      {
        "ref": {
          "kind": "thread",
          "id": "root/code-structure-converse/dependence-balance-and-channel-refinement"
        },
        "parentRef": {
          "kind": "program",
          "id": "root/code-structure-converse"
        },
        "status": "active",
        "roles": [
          "local-thread"
        ],
        "recordDigest": "sha256:be35b9071e3c1771d6de37cf8dedb082627ae39b1a8d02daa2cd2d4b401de358"
      },
      {
        "ref": {
          "kind": "thread",
          "id": "root/code-structure-converse/unstructured-search"
        },
        "parentRef": {
          "kind": "program",
          "id": "root/code-structure-converse"
        },
        "status": "active",
        "roles": [
          "local-thread"
        ],
        "recordDigest": "sha256:21542d60cc740c3de51655b277c1d05f68529005f8a3320e510f5e3b0dab75ef"
      },
      {
        "ref": {
          "kind": "thread",
          "id": "root/unstructured-search"
        },
        "parentRef": {
          "kind": "program",
          "id": "root"
        },
        "status": "active",
        "roles": [
          "local-thread",
          "seed"
        ],
        "recordDigest": "sha256:593d11c9f455aa91fa91e9083a6bb6ffcf4823726f6843239f552eb8fe24b48e"
      }
    ],
    "boundarySummaries": [],
    "semanticItemRefs": [
      {
        "itemId": "root/code-structure-converse/code-induced-dependence-balance",
        "programRef": {
          "kind": "program",
          "id": "root/code-structure-converse"
        },
        "itemType": "result",
        "claimRefs": [
          {
            "claimKey": "bssc-sum-capacity/code-induced-dependence-balance-and-entropy-no-go",
            "transactionId": "c70e1829a7c6a2a8cb8cfc2383f8abf825ac5ea6"
          }
        ],
        "dependencyItemIds": [
          "root/code-structure-converse/finite-block-balance-proof"
        ],
        "recordDigest": "sha256:f7f13394e11395e8d2f2728659d807142ed525017b688668eefdbfd92b06810d"
      },
      {
        "itemId": "root/code-structure-converse/copy-extension-proof",
        "programRef": {
          "kind": "program",
          "id": "root/code-structure-converse"
        },
        "itemType": "proof",
        "claimRefs": [],
        "dependencyItemIds": [
          "root/code-structure-converse/entropy-counterfeit-witness"
        ],
        "recordDigest": "sha256:7d4d8300feed467f40d7cab85ca12c51db03fb897daf2c88ae3aca9e8b11d2bf"
      },
      {
        "itemId": "root/code-structure-converse/entropy-copy-no-go",
        "programRef": {
          "kind": "program",
          "id": "root/code-structure-converse"
        },
        "itemType": "result",
        "claimRefs": [
          {
            "claimKey": "bssc-sum-capacity/code-induced-dependence-balance-and-entropy-no-go",
            "transactionId": "c70e1829a7c6a2a8cb8cfc2383f8abf825ac5ea6"
          }
        ],
        "dependencyItemIds": [
          "root/code-structure-converse/copy-extension-proof",
          "root/code-structure-converse/entropy-counterfeit-witness"
        ],
        "recordDigest": "sha256:4d3e3bb55a0cf45bcf1ed21e6dc7fbbc3462691f9b2907fa300128bd53a97d83"
      },
      {
        "itemId": "root/code-structure-converse/entropy-counterfeit-witness",
        "programRef": {
          "kind": "program",
          "id": "root/code-structure-converse"
        },
        "itemType": "computation",
        "claimRefs": [],
        "dependencyItemIds": [
          "root/code-structure-converse/code-induced-dependence-balance"
        ],
        "recordDigest": "sha256:051254fb85f0e7177352428a4a9c735952678f44d3b7ed4242885bd43e8a9a56"
      },
      {
        "itemId": "root/code-structure-converse/exact-witness-checker",
        "programRef": {
          "kind": "program",
          "id": "root/code-structure-converse"
        },
        "itemType": "tool",
        "claimRefs": [],
        "dependencyItemIds": [
          "root/code-structure-converse/entropy-counterfeit-witness"
        ],
        "recordDigest": "sha256:caeffc0ea1de4056a6c4e5691e5bf171b8d8197a6eae501fe6f1d8c1921d2e30"
      },
      {
        "itemId": "root/code-structure-converse/finite-block-balance-proof",
        "programRef": {
          "kind": "program",
          "id": "root/code-structure-converse"
        },
        "itemType": "proof",
        "claimRefs": [],
        "dependencyItemIds": [],
        "recordDigest": "sha256:6b5eb4b706c1b19bdc51166ed41e9daa809d20f3bca4deaa44903d8fa8d8de3b"
      }
    ],
    "expansionPolicy": {
      "allowedKinds": [
        "program",
        "thread"
      ],
      "maximumDescendantDepth": 4,
      "requiresExactBuilderNode": true
    },
    "contextDigest": "sha256:e8c5e7a510dcc16b65cc984e4997e18057d6933a3706ed387595b20851fbcd34"
  },
  "evidenceManifest": {
    "chunkSizeBytes": 65536,
    "contributionPath": "problems/bssc-sum-capacity/contributions/code-induced-dependence-balance-and-entropy-no-go",
    "files": [
      {
        "bytes": 9124,
        "chunks": [
          {
            "bytes": 9124,
            "digest": "sha256:d86f552c74e3ba4b132e942f03b033af8da52a668d9e58eab111fac3bfafd025",
            "offset": 0,
            "ordinal": 0
          }
        ],
        "digest": "sha256:d86f552c74e3ba4b132e942f03b033af8da52a668d9e58eab111fac3bfafd025",
        "path": "problems/bssc-sum-capacity/contributions/code-induced-dependence-balance-and-entropy-no-go/README.md"
      },
      {
        "bytes": 12262,
        "chunks": [
          {
            "bytes": 12262,
            "digest": "sha256:a11816b72452187bed84f3d9d32ef6fa2788f444077222fc66854ba2cf9cccc8",
            "offset": 0,
            "ordinal": 0
          }
        ],
        "digest": "sha256:a11816b72452187bed84f3d9d32ef6fa2788f444077222fc66854ba2cf9cccc8",
        "path": "problems/bssc-sum-capacity/contributions/code-induced-dependence-balance-and-entropy-no-go/source-artifacts/upper-dependence-balance/FULL.md"
      },
      {
        "bytes": 12844,
        "chunks": [
          {
            "bytes": 12844,
            "digest": "sha256:ad7b04c34212cb4dc7debc04fb4c0a37cb4dad1e91dcb14c0000104b8120b779",
            "offset": 0,
            "ordinal": 0
          }
        ],
        "digest": "sha256:ad7b04c34212cb4dc7debc04fb4c0a37cb4dad1e91dcb14c0000104b8120b779",
        "path": "problems/bssc-sum-capacity/contributions/code-induced-dependence-balance-and-entropy-no-go/source-artifacts/upper-entropy-nogo/FULL.md"
      },
      {
        "bytes": 6771,
        "chunks": [
          {
            "bytes": 6771,
            "digest": "sha256:0be3d1bf7dfc02f22cc55cd52fafcb7e9290cfb32db7d4a103a570deefb0f32b",
            "offset": 0,
            "ordinal": 0
          }
        ],
        "digest": "sha256:0be3d1bf7dfc02f22cc55cd52fafcb7e9290cfb32db7d4a103a570deefb0f32b",
        "path": "problems/bssc-sum-capacity/contributions/code-induced-dependence-balance-and-entropy-no-go/verify_exact_witness.py"
      }
    ],
    "manifestDigest": "sha256:4851a0687f975a125a86eb07e04c2365aa09a4f502571b0813cf8148fd3da7ee",
    "problemId": "bssc-sum-capacity",
    "schemaVersion": 1,
    "sourceRevision": "c70e1829a7c6a2a8cb8cfc2383f8abf825ac5ea6",
    "subjectTransactionId": "c70e1829a7c6a2a8cb8cfc2383f8abf825ac5ea6",
    "submissionDigest": "sha256:443a09f117f51d2d000008794d7abf0937e78e057083894219dd7ea7f0fa688b",
    "totalBytes": 41001
  },
  "verifiedChunkDigests": [
    "sha256:0be3d1bf7dfc02f22cc55cd52fafcb7e9290cfb32db7d4a103a570deefb0f32b",